,0,1,2
0,Didahului oleh:Patrick Henry,Gubernur Virginia1779 – 1781,Diteruskan oleh:William Fleming
1,Didahului oleh:Benjamin Franklin,Duta Besar Luar Biasa dan Berkuasa Penuh Amerika Serikat untuk Prancis1785 – 1789,Diteruskan oleh:William Short
2,Didahului oleh:John Jay(sebagai Sekretaris Menteri Luar Negeri Amerika Serikat),Sekretaris Negara Amerika Serikat26 September 1789 – 31 Desember 1793,Diteruskan oleh:Edmund Randolph
3,Didahului oleh:(Tidak Ada),"Kandidat Presiden Partai Demokrat-Republik1796 (menang untuk posisi wakil presiden)(a),1800 (menang sebagai presiden),1804 (menang)",Diteruskan oleh:James Madison
4,Didahului oleh:John Adams,Wakil Presiden Amerika Serikat4 Maret 1797 – 4 Maret 1801,Diteruskan oleh:Aaron Burr
5,Didahului oleh:John Adams,Presiden Amerika Serikat4 Maret 1801 – 4 Maret 1809,Diteruskan oleh:James Madison
